{
  "export_meta": {
    "version": "config-asset-export-v1",
    "exported_at": "2026-05-27T08:00:00Z",
    "source_instance": "dev-presales-cio-bootstrap",
    "exported_by": "00000000-0000-4000-8000-000000000001",
    "export_audit_recorded": false,
    "notes": "Presales CIO first-visit import-first bootstrap package. Generated from the Config Asset Export v1 service contract and kept as the deployable bootstrap artifact for #105."
  },
  "assets": [
    {
      "asset_type": "agent",
      "namespace": "default",
      "natural_key": "bootstrap-agent",
      "name": "售前训练智能体",
      "version": 1,
      "content_hash": "sha256:1111111111111111111111111111111111111111111111111111111111111111",
      "status": "published",
      "governance": "native_lifecycle",
      "payload": {
        "name": "售前训练智能体",
        "description": "面向销售售前首访训练的通用智能体入口。",
        "category": "sales",
        "welcome_message": "开始首访训练。",
        "capabilities_config": {
          "roleplay": true,
          "study": true,
          "exam": true,
          "report": true
        },
        "status": "published"
      },
      "depends_on": []
    },
    {
      "asset_type": "voice_runtime_profile",
      "namespace": "default",
      "natural_key": "bootstrap-runtime",
      "name": "售前首访实时语音配置",
      "version": 1,
      "content_hash": "sha256:2222222222222222222222222222222222222222222222222222222222222222",
      "status": "published",
      "governance": "native_lifecycle",
      "payload": {
        "name": "售前首访实时语音配置",
        "description": "首访客户对练默认 StepFun realtime 配置。",
        "is_default": false,
        "is_active": true,
        "voice_mode": "stepfun_realtime",
        "model_name": "stepaudio-2.5-realtime",
        "voice_name": "qingchunshaonv",
        "temperature": 0.7,
        "input_audio_format": "pcm16",
        "output_audio_format": "pcm16",
        "output_sample_rate": 24000,
        "turn_detection": null,
        "tool_policy": {
          "enable_web_search": false,
          "enable_internal_retrieval": true,
          "require_grounding": true,
          "network_access_mode": "off"
        }
      },
      "depends_on": []
    },
    {
      "asset_type": "scoring_ruleset",
      "namespace": "default",
      "natural_key": "sales-bootstrap",
      "name": "销售首访基础评分规则",
      "version": "sales-bootstrap",
      "content_hash": "sha256:3333333333333333333333333333333333333333333333333333333333333333",
      "status": "published",
      "governance": "native_lifecycle",
      "payload": {
        "scenario_type": "sales",
        "version": "sales-bootstrap",
        "display_name": "销售首访基础评分规则",
        "description": "用于 Presales CIO 首访闭环训练的基础评分规则。",
        "definition": {
          "schema_version": "scoring_ruleset_schema_v1",
          "scenario_type": "sales",
          "score_basis": "session_evidence_projection_evaluable_only",
          "dimensions": [
            {
              "dimension_id": "value_expression",
              "label": "价值表达",
              "weight": 0.6,
              "rollup_contributions": [
                {
                  "rollup_id": "logic",
                  "weight": 0.6
                }
              ],
              "min_evidence": {},
              "description": null
            },
            {
              "dimension_id": "customer_benefit_connection",
              "label": "客户收益连接",
              "weight": 0.85,
              "rollup_contributions": [
                {
                  "rollup_id": "logic",
                  "weight": 0.4
                },
                {
                  "rollup_id": "accuracy",
                  "weight": 0.45
                }
              ],
              "min_evidence": {},
              "description": null
            },
            {
              "dimension_id": "evidence_usage",
              "label": "证据使用",
              "weight": 0.55,
              "rollup_contributions": [
                {
                  "rollup_id": "accuracy",
                  "weight": 0.55
                }
              ],
              "min_evidence": {},
              "description": null
            },
            {
              "dimension_id": "objection_handling",
              "label": "异议处理",
              "weight": 0.6,
              "rollup_contributions": [
                {
                  "rollup_id": "completeness",
                  "weight": 0.6
                }
              ],
              "min_evidence": {},
              "description": null
            },
            {
              "dimension_id": "next_step_commitment",
              "label": "推进下一步",
              "weight": 0.4,
              "rollup_contributions": [
                {
                  "rollup_id": "completeness",
                  "weight": 0.4
                }
              ],
              "min_evidence": {},
              "description": null
            }
          ],
          "min_evidence": {
            "min_messages": 1,
            "require_score_evidence": true,
            "require_stage_evidence": false
          },
          "not_evaluable_reasons": {
            "missing_min_messages": "缺少足够对话证据，无法按当前评分规则评估。",
            "missing_score_evidence": "缺少会话分数或实时评分证据，无法按当前评分规则评估。",
            "missing_stage_evidence": "缺少销售阶段证据，无法按当前评分规则评估。"
          },
          "passing_score": null,
          "rubric": null,
          "hidden_information_coverage": [],
          "deductions": [],
          "roleplay_contract_version": null
        },
        "status": "published",
        "is_active": true
      },
      "depends_on": []
    },
    {
      "asset_type": "knowledge_base",
      "namespace": "default",
      "natural_key": "presales-cio-first-visit-kb",
      "name": "制造业 CIO 首访售前知识库",
      "version": 1,
      "content_hash": "sha256:4444444444444444444444444444444444444444444444444444444444444444",
      "status": "published",
      "governance": "native_lifecycle",
      "payload": {
        "name": "制造业 CIO 首访售前知识库",
        "description": "制造业数字化、CIO 首访需求挖掘、集成风险和 ROI 证据知识。",
        "category": "product",
        "collection_name": "presales_cio_first_visit",
        "status": "published"
      },
      "depends_on": []
    },
    {
      "asset_type": "learning_content",
      "namespace": "default",
      "natural_key": "cio-first-visit-camp",
      "name": "制造业 CIO 首访训练营",
      "version": 1,
      "content_hash": "sha256:5555555555555555555555555555555555555555555555555555555555555555",
      "status": "published",
      "governance": "native_lifecycle",
      "payload": {
        "title": "制造业 CIO 首访训练营",
        "summary": "首访目标、关系边界、问题探索和证据准备。",
        "owner": "sales-enablement",
        "source": "config-asset-bootstrap",
        "safety_flagged": false,
        "chapters": [
          {
            "title": "首访边界",
            "content": "首次拜访阶段只建立信任、确认业务背景、澄清痛点和约定下一步，不直接报价或承诺 ROI。",
            "order_index": 1
          },
          {
            "title": "CIO 关注点",
            "content": "制造业 CIO 通常关注系统集成风险、生产连续性、数据治理、投入产出证据和组织协同成本。",
            "order_index": 2
          }
        ],
        "status": "published"
      },
      "depends_on": []
    },
    {
      "asset_type": "question_category",
      "namespace": "default",
      "natural_key": "cio-first-visit-exam",
      "name": "CIO 首访考核",
      "version": 1,
      "content_hash": "sha256:6666666666666666666666666666666666666666666666666666666666666666",
      "status": "published",
      "governance": "native_lifecycle",
      "payload": {
        "name": "CIO 首访考核",
        "description": "制造业 CIO 首访场景的基础考核题。",
        "order_index": 1
      },
      "depends_on": []
    },
    {
      "asset_type": "question_item",
      "namespace": "default",
      "natural_key": "cio-first-visit-discovery-question",
      "name": "首访中应优先确认什么",
      "version": 1,
      "content_hash": "sha256:7777777777777777777777777777777777777777777777777777777777777777",
      "status": "published",
      "governance": "native_lifecycle",
      "payload": {
        "title": "首访中应优先确认什么",
        "stem": "面对首次接触的制造业 CIO，售前顾问应优先确认哪些信息，哪些动作应避免？",
        "reference_answer": "应优先确认业务背景、当前系统约束、痛点影响、决策链和下一步验证方式；应避免假装已有关系、直接报价、承诺未验证 ROI 或一次性套取隐藏预算。",
        "scoring_criteria": {
          "dimensions": [
            "relationship_boundary",
            "pain_discovery",
            "evidence_orientation"
          ]
        },
        "scoring_dimensions": [
          "relationship_boundary",
          "pain_discovery",
          "evidence_orientation"
        ],
        "tags": ["first_visit", "cio", "discovery"],
        "difficulty": "medium",
        "safety_flagged": false,
        "department": "sales",
        "asset_refs": {
          "category": {
            "asset_type": "question_category",
            "namespace": "default",
            "natural_key": "cio-first-visit-exam"
          }
        },
        "status": "published"
      },
      "depends_on": [
        {
          "asset_type": "question_category",
          "namespace": "default",
          "natural_key": "cio-first-visit-exam"
        }
      ]
    },
    {
      "asset_type": "examiner_agent",
      "namespace": "default",
      "natural_key": "cio-first-visit-examiner",
      "name": "CIO 首访考官",
      "version": 1,
      "content_hash": "sha256:8888888888888888888888888888888888888888888888888888888888888888",
      "status": "published",
      "governance": "native_lifecycle",
      "payload": {
        "name": "CIO 首访考官",
        "description": "评估销售是否理解首次拜访边界与 CIO 需求探索。",
        "learner_level_strategy": {
          "default_level": "beginner",
          "allowed_levels": ["conservative", "beginner", "intermediate", "advanced"]
        },
        "timeout_config": {
          "max_seconds": 900
        },
        "safety_config": {},
        "prompt_config": {
          "grading_focus": "first_visit_boundary"
        },
        "simulation_config": {},
        "asset_refs": {